{
  "$schema": "https://json-schema.org/draft/2020-12/schema",
  "title": "document.memory_manufacturing data/manufacturing/processes",
  "type": "object",
  "additionalProperties": false,
  "required": [
    "$schema",
    "schema_version",
    "id",
    "record_type",
    "data"
  ],
  "properties": {
    "$schema": {
      "type": "string"
    },
    "schema_version": {
      "const": "1.0.0"
    },
    "id": {
      "type": "string",
      "minLength": 1
    },
    "record_type": {
      "const": "document-section"
    },
    "data": {
      "type": "object",
      "additionalProperties": false,
      "required": [
        "status",
        "era_policy",
        "memory_recipes",
        "selection_policy",
        "repair_model",
        "qualification",
        "quarterly_process_envelope",
        "envelope_limits"
      ],
      "properties": {
        "status": {
          "type": "string"
        },
        "era_policy": {
          "type": "string"
        },
        "memory_recipes": {
          "type": "array"
        },
        "selection_policy": {
          "type": "string"
        },
        "repair_model": {
          "type": "string"
        },
        "qualification": {
          "type": "array"
        },
        "quarterly_process_envelope": {
          "type": "array"
        },
        "envelope_limits": {
          "type": "string"
        }
      }
    }
  }
}
