{
  "$schema": "../../../schemas/documents/document.memory_manufacturing-data-manufacturing-processes.schema.json",
  "schema_version": "1.0.0",
  "id": "document.memory_manufacturing",
  "record_type": "document-section",
  "data": {
    "status": "Accepted alternative-history planning scenario; all production releases require engineering qualification.",
    "era_policy": "ERA1 and its 6/8 MHz variants remain 55 mm2 on the original 3.0 um Micralign process. No CPU shrink or speed-bin uplift.",
    "memory_recipes": [
      {
        "id": "dram64_3um_launch",
        "node_um": "3.0",
        "available_from": "1979-12-03",
        "die_area_mm2": 45,
        "defect_density_cm2": 2.4,
        "nonarea_yield": 0.7224999999999999,
        "processed_wafer_usd": 220,
        "repair_fraction_of_spatial_failures": 0
      },
      {
        "id": "dram64_3um_control",
        "node_um": "3.0",
        "available_from": "1980-06-01",
        "die_area_mm2": 45,
        "defect_density_cm2": 2.0,
        "nonarea_yield": 0.765,
        "processed_wafer_usd": 235,
        "repair_fraction_of_spatial_failures": 0
      },
      {
        "id": "dram64_3um_repair",
        "node_um": "3.0",
        "available_from": "1981-01-01",
        "die_area_mm2": 47.25,
        "defect_density_cm2": 1.7,
        "nonarea_yield": 0.765,
        "processed_wafer_usd": 255,
        "repair_fraction_of_spatial_failures": 0.35,
        "repair_cost_per_wafer_usd": 12
      },
      {
        "id": "dram64_275um_repair",
        "node_um": "2.75",
        "available_from": "1981-06-01",
        "die_area_mm2": 40,
        "defect_density_cm2": 2.6,
        "nonarea_yield": 0.748,
        "processed_wafer_usd": 285,
        "repair_fraction_of_spatial_failures": 0.35,
        "repair_cost_per_wafer_usd": 12
      },
      {
        "id": "dram64_2um_repair",
        "node_um": "2.0",
        "available_from": "1982-07-01",
        "die_area_mm2": 28,
        "defect_density_cm2": 2.6,
        "nonarea_yield": 0.765,
        "processed_wafer_usd": 340,
        "repair_fraction_of_spatial_failures": 0.35,
        "repair_cost_per_wafer_usd": 12
      },
      {
        "id": "dram64_15um_repair",
        "node_um": "1.5",
        "available_from": "1983-10-01",
        "die_area_mm2": 19,
        "defect_density_cm2": 2.5,
        "nonarea_yield": 0.7224999999999999,
        "processed_wafer_usd": 400,
        "repair_fraction_of_spatial_failures": 0.35,
        "repair_cost_per_wafer_usd": 15
      }
    ],
    "selection_policy": "Minimum recurring cost among date-qualified 64K x 1 recipes, same 75 mm wafer and electrical contract. 2.75 um is evaluated against repaired 3 um; smaller node alone does not select production.",
    "repair_model": "Y=Y0*(exp(-D*A/100)+r*(1-exp(-D*A/100))). r=.35 is the assumed recoverable share of spatial die failures, not all failing dies. Never repair Y0 losses. Spare structures add 5% area to 3 um. Repair operations/testing add recurring wafer cost. No historical multiplier is imported.",
    "qualification": [
      "Released capacity/pinout/rails and refresh contract",
      "Retention over temperature and voltage, read/write and disturb tests",
      "Defect-map coverage and fuse programming with full post-repair retest",
      "Speed bins and all-bank board power/timing qualification",
      "At least two matched steppers and recipe-specific one-down capacity before volume stepper manufacture"
    ],
    "quarterly_process_envelope": [
      {
        "quarter": "1979-Q4",
        "node_um": 2.75,
        "defect_density_cm2": 6,
        "nonarea_yield": 0.65,
        "yield_budgets": [
          {
            "target_yield": 0.1,
            "die_area_mm2": 31.2,
            "logic_transistors": 25989
          },
          {
            "target_yield": 0.25,
            "die_area_mm2": 15.93,
            "logic_transistors": 13267
          },
          {
            "target_yield": 0.5,
            "die_area_mm2": 4.37,
            "logic_transistors": 3643
          }
        ]
      },
      {
        "quarter": "1980-Q1",
        "node_um": 2.75,
        "defect_density_cm2": 5,
        "nonarea_yield": 0.75,
        "yield_budgets": [
          {
            "target_yield": 0.1,
            "die_area_mm2": 40.3,
            "logic_transistors": 33571
          },
          {
            "target_yield": 0.25,
            "die_area_mm2": 21.97,
            "logic_transistors": 18304
          },
          {
            "target_yield": 0.5,
            "die_area_mm2": 8.11,
            "logic_transistors": 6756
          }
        ]
      },
      {
        "quarter": "1980-Q2",
        "node_um": 2.75,
        "defect_density_cm2": 4,
        "nonarea_yield": 0.8,
        "yield_budgets": [
          {
            "target_yield": 0.1,
            "die_area_mm2": 51.99,
            "logic_transistors": 43307
          },
          {
            "target_yield": 0.25,
            "die_area_mm2": 29.08,
            "logic_transistors": 24224
          },
          {
            "target_yield": 0.5,
            "die_area_mm2": 11.75,
            "logic_transistors": 9789
          }
        ]
      },
      {
        "quarter": "1980-Q3",
        "node_um": 2.75,
        "defect_density_cm2": 3.5,
        "nonarea_yield": 0.83,
        "yield_budgets": [
          {
            "target_yield": 0.1,
            "die_area_mm2": 60.46,
            "logic_transistors": 50370
          },
          {
            "target_yield": 0.25,
            "die_area_mm2": 34.28,
            "logic_transistors": 28561
          },
          {
            "target_yield": 0.5,
            "die_area_mm2": 14.48,
            "logic_transistors": 12063
          }
        ]
      },
      {
        "quarter": "1980-Q4",
        "node_um": 2.75,
        "defect_density_cm2": 3,
        "nonarea_yield": 0.85,
        "yield_budgets": [
          {
            "target_yield": 0.1,
            "die_area_mm2": 71.34,
            "logic_transistors": 59427
          },
          {
            "target_yield": 0.25,
            "die_area_mm2": 40.79,
            "logic_transistors": 33983
          },
          {
            "target_yield": 0.5,
            "die_area_mm2": 17.69,
            "logic_transistors": 14735
          }
        ]
      },
      {
        "quarter": "1981-Q1",
        "node_um": 2.75,
        "defect_density_cm2": 2.8,
        "nonarea_yield": 0.85,
        "yield_budgets": [
          {
            "target_yield": 0.1,
            "die_area_mm2": 76.43,
            "logic_transistors": 63671
          },
          {
            "target_yield": 0.25,
            "die_area_mm2": 43.71,
            "logic_transistors": 36410
          },
          {
            "target_yield": 0.5,
            "die_area_mm2": 18.95,
            "logic_transistors": 15787
          }
        ]
      },
      {
        "quarter": "1981-Q2",
        "node_um": 2.75,
        "defect_density_cm2": 2.6,
        "nonarea_yield": 0.88,
        "yield_budgets": [
          {
            "target_yield": 0.1,
            "die_area_mm2": 83.64,
            "logic_transistors": 69681
          },
          {
            "target_yield": 0.25,
            "die_area_mm2": 48.4,
            "logic_transistors": 40322
          },
          {
            "target_yield": 0.5,
            "die_area_mm2": 21.74,
            "logic_transistors": 18113
          }
        ]
      },
      {
        "quarter": "1981-Q3",
        "node_um": 2,
        "defect_density_cm2": 4.5,
        "nonarea_yield": 0.7,
        "yield_budgets": [
          {
            "target_yield": 0.1,
            "die_area_mm2": 43.24,
            "logic_transistors": 68107
          },
          {
            "target_yield": 0.25,
            "die_area_mm2": 22.88,
            "logic_transistors": 36037
          },
          {
            "target_yield": 0.5,
            "die_area_mm2": 7.48,
            "logic_transistors": 11777
          }
        ]
      },
      {
        "quarter": "1981-Q4",
        "node_um": 2,
        "defect_density_cm2": 4,
        "nonarea_yield": 0.75,
        "yield_budgets": [
          {
            "target_yield": 0.1,
            "die_area_mm2": 50.37,
            "logic_transistors": 79337
          },
          {
            "target_yield": 0.25,
            "die_area_mm2": 27.47,
            "logic_transistors": 43258
          },
          {
            "target_yield": 0.5,
            "die_area_mm2": 10.14,
            "logic_transistors": 15965
          }
        ]
      },
      {
        "quarter": "1982-Q1",
        "node_um": 2,
        "defect_density_cm2": 3.5,
        "nonarea_yield": 0.8,
        "yield_budgets": [
          {
            "target_yield": 0.1,
            "die_area_mm2": 59.41,
            "logic_transistors": 93575
          },
          {
            "target_yield": 0.25,
            "die_area_mm2": 33.23,
            "logic_transistors": 52342
          },
          {
            "target_yield": 0.5,
            "die_area_mm2": 13.43,
            "logic_transistors": 21150
          }
        ]
      },
      {
        "quarter": "1982-Q2",
        "node_um": 2,
        "defect_density_cm2": 3,
        "nonarea_yield": 0.83,
        "yield_budgets": [
          {
            "target_yield": 0.1,
            "die_area_mm2": 70.54,
            "logic_transistors": 111103
          },
          {
            "target_yield": 0.25,
            "die_area_mm2": 40.0,
            "logic_transistors": 62998
          },
          {
            "target_yield": 0.5,
            "die_area_mm2": 16.89,
            "logic_transistors": 26608
          }
        ]
      },
      {
        "quarter": "1982-Q3",
        "node_um": 2,
        "defect_density_cm2": 2.6,
        "nonarea_yield": 0.85,
        "yield_budgets": [
          {
            "target_yield": 0.1,
            "die_area_mm2": 82.31,